{
  "$schema": "../../reports/schemas/policy-evaluation-report.schema.json",
  "reportType": "PolicyEvaluationReport",
  "reportVersion": "0.1.0",
  "evaluationId": "per-94c9870ac6013537",
  "overallDecision": "ACCEPT",
  "policy": {
    "policyId": "central-bank-domestic-window-policy",
    "policyVersion": "1.0.0",
    "cplVersion": "0.1.0",
    "profile": "central_bank"
  },
  "inventory": {
    "inventorySetId": "margin-call-quickstart-positive-inventory",
    "inventoryVersion": "1.0.0",
    "asOf": "2026-04-15T14:00:00Z",
    "settlementCurrency": "USD",
    "valuationCurrency": "USD",
    "candidateLotCount": 4
  },
  "summary": {
    "candidateLotCount": 4,
    "decisionCounts": {
      "eligible": 4,
      "ineligible": 0,
      "escalate": 0,
      "review": 0
    },
    "totalMarketValue": 1200000.0,
    "totalLendableValue": 1131000.0,
    "concentrationIssueCount": 0
  },
  "portfolioReasons": [],
  "assetResults": [
    {
      "lotId": "quickstart-demo-lot-101",
      "assetId": "ust-2027-01",
      "decision": "ELIGIBLE",
      "assetClass": "SOVEREIGN_BOND",
      "issueType": "SOVEREIGN",
      "issuerId": "us-treasury",
      "issuerType": "SOVEREIGN",
      "issuerGroupIds": [
        "us-sovereign-group"
      ],
      "longTermRating": "AA+",
      "collateralCurrency": "USD",
      "issuanceJurisdiction": "US",
      "riskJurisdiction": "US",
      "custodianId": "new-york-fed",
      "custodyJurisdiction": "US",
      "accountType": "CENTRAL_BANK_ACCOUNT",
      "residualMaturityDays": 180,
      "marketValue": 300000.0,
      "valuationBasisValue": 300000.0,
      "baseHaircutBps": 200,
      "currencyMismatchHaircutBps": 0,
      "totalHaircutBps": 200,
      "matchedHaircutRuleIds": [
        "domestic-sovereign-short"
      ],
      "appliedHaircutRuleIds": [
        "domestic-sovereign-short"
      ],
      "lendableValue": 294000.0,
      "reasons": []
    },
    {
      "lotId": "quickstart-demo-lot-102",
      "assetId": "kfw-2029-01",
      "decision": "ELIGIBLE",
      "assetClass": "AGENCY_BOND",
      "issueType": "AGENCY",
      "issuerId": "kfw",
      "issuerType": "AGENCY",
      "issuerGroupIds": [
        "kfw-group"
      ],
      "longTermRating": "AAA",
      "collateralCurrency": "USD",
      "issuanceJurisdiction": "DE",
      "riskJurisdiction": "DE",
      "custodianId": "euroclear-bank",
      "custodyJurisdiction": "BE",
      "accountType": "THIRD_PARTY_CUSTODY",
      "residualMaturityDays": 720,
      "marketValue": 300000.0,
      "valuationBasisValue": 300000.0,
      "baseHaircutBps": 700,
      "currencyMismatchHaircutBps": 0,
      "totalHaircutBps": 700,
      "matchedHaircutRuleIds": [
        "agency-and-supranational"
      ],
      "appliedHaircutRuleIds": [
        "agency-and-supranational"
      ],
      "lendableValue": 279000.0,
      "reasons": []
    },
    {
      "lotId": "quickstart-demo-lot-103",
      "assetId": "eib-2030-01",
      "decision": "ELIGIBLE",
      "assetClass": "SUPRANATIONAL_BOND",
      "issueType": "SUPRANATIONAL",
      "issuerId": "eib",
      "issuerType": "SUPRANATIONAL",
      "issuerGroupIds": [
        "eib-group"
      ],
      "longTermRating": "AAA",
      "collateralCurrency": "USD",
      "issuanceJurisdiction": "FR",
      "riskJurisdiction": "FR",
      "custodianId": "euroclear-bank",
      "custodyJurisdiction": "BE",
      "accountType": "THIRD_PARTY_CUSTODY",
      "residualMaturityDays": 900,
      "marketValue": 300000.0,
      "valuationBasisValue": 300000.0,
      "baseHaircutBps": 700,
      "currencyMismatchHaircutBps": 0,
      "totalHaircutBps": 700,
      "matchedHaircutRuleIds": [
        "agency-and-supranational"
      ],
      "appliedHaircutRuleIds": [
        "agency-and-supranational"
      ],
      "lendableValue": 279000.0,
      "reasons": []
    },
    {
      "lotId": "quickstart-demo-lot-104",
      "assetId": "fannie-2028-01",
      "decision": "ELIGIBLE",
      "assetClass": "AGENCY_BOND",
      "issueType": "AGENCY",
      "issuerId": "fannie-mae",
      "issuerType": "AGENCY",
      "issuerGroupIds": [
        "fannie-group"
      ],
      "longTermRating": "AA",
      "collateralCurrency": "USD",
      "issuanceJurisdiction": "US",
      "riskJurisdiction": "US",
      "custodianId": "new-york-fed",
      "custodyJurisdiction": "US",
      "accountType": "CENTRAL_BANK_ACCOUNT",
      "residualMaturityDays": 540,
      "marketValue": 300000.0,
      "valuationBasisValue": 300000.0,
      "baseHaircutBps": 700,
      "currencyMismatchHaircutBps": 0,
      "totalHaircutBps": 700,
      "matchedHaircutRuleIds": [
        "agency-and-supranational"
      ],
      "appliedHaircutRuleIds": [
        "agency-and-supranational"
      ],
      "lendableValue": 279000.0,
      "reasons": []
    }
  ],
  "concentrationResults": [
    {
      "limitId": "issuer-cap",
      "dimension": "ISSUER",
      "scope": "POLICY_PORTFOLIO",
      "metric": "PERCENT_OF_COLLATERAL_VALUE",
      "decision": "PASS",
      "thresholdValue": 0.25,
      "thresholdCurrency": null,
      "bucket": "eib",
      "bucketValue": 300000.0,
      "denominatorValue": 1200000.0,
      "observedRatio": 0.25,
      "relatedLotIds": [
        "quickstart-demo-lot-103"
      ],
      "reason": null
    },
    {
      "limitId": "issuer-cap",
      "dimension": "ISSUER",
      "scope": "POLICY_PORTFOLIO",
      "metric": "PERCENT_OF_COLLATERAL_VALUE",
      "decision": "PASS",
      "thresholdValue": 0.25,
      "thresholdCurrency": null,
      "bucket": "fannie-mae",
      "bucketValue": 300000.0,
      "denominatorValue": 1200000.0,
      "observedRatio": 0.25,
      "relatedLotIds": [
        "quickstart-demo-lot-104"
      ],
      "reason": null
    },
    {
      "limitId": "issuer-cap",
      "dimension": "ISSUER",
      "scope": "POLICY_PORTFOLIO",
      "metric": "PERCENT_OF_COLLATERAL_VALUE",
      "decision": "PASS",
      "thresholdValue": 0.25,
      "thresholdCurrency": null,
      "bucket": "kfw",
      "bucketValue": 300000.0,
      "denominatorValue": 1200000.0,
      "observedRatio": 0.25,
      "relatedLotIds": [
        "quickstart-demo-lot-102"
      ],
      "reason": null
    },
    {
      "limitId": "issuer-cap",
      "dimension": "ISSUER",
      "scope": "POLICY_PORTFOLIO",
      "metric": "PERCENT_OF_COLLATERAL_VALUE",
      "decision": "PASS",
      "thresholdValue": 0.25,
      "thresholdCurrency": null,
      "bucket": "us-treasury",
      "bucketValue": 300000.0,
      "denominatorValue": 1200000.0,
      "observedRatio": 0.25,
      "relatedLotIds": [
        "quickstart-demo-lot-101"
      ],
      "reason": null
    }
  ]
}
